{
  "schema_version": "1.0.0",
  "registry_id": "ahangban-artist-registry",
  "generated_on": "2026-10-18",
  "source_of_truth": "artists.json",
  "scope": "فقط نامزدهای ثبت‌شده در فایل صف تحقیق مخزن؛ نه فهرست قطعی سایت",
  "site_database_available": false,
  "records": [
    {
      "artist_id": "AB-CAND-001",
      "display_name_fa": "آرش",
      "official_or_latin_name": "Arash",
      "aliases": [],
      "slug": null,
      "entity_type": "UNKNOWN",
      "short_bio": null,
      "full_bio": null,
      "profile_image": null,
      "featured_image": null,
      "genres_as_reported": [
        "پاپ"
      ],
      "official_website": null,
      "verified_social_profiles": [],
      "related_track_ids": [],
      "related_album_ids": [],
      "related_video_ids": [],
      "site_page_status": "UNKNOWN",
      "identity_status": "NEEDS_REVIEW",
      "completion": {
        "name": "NEEDS_REVIEW",
        "slug": "INCOMPLETE",
        "biography": "INCOMPLETE",
        "featured_image": "INCOMPLETE",
        "reliable_sources": "NEEDS_REVIEW",
        "official_links": "UNKNOWN",
        "track_album_relationships": "UNKNOWN",
        "artist_page": "UNKNOWN",
        "seo_title_description": "INCOMPLETE",
        "broken_links_and_duplicates": "NEEDS_REVIEW",
        "final_quality_control": "INCOMPLETE"
      },
      "priority": "P0-Global",
      "segment_as_reported": "معاصر",
      "seed_reason": "در ۱۰ هنرمند نخست نمایهٔ عمومی FarsiChart",
      "seed_source_snapshot": "2026-09-30; Spotify public monthly listeners",
      "rights_status": "UNVERIFIED",
      "source_refs": [],
      "next_action": "هویت هنرمند و مالک ضبط/ناشر را تطبیق دهید",
      "last_reviewed_on": null,
      "review_notes": "این مورد فقط نامزدِ صف تحقیق موجود در مخزن است؛ ثبت در سایت یا تأیید هویت/منبع/حقوق از آن نتیجه نمی‌شود.",
      "seed_next_action": "هویت هنرمند و مالک ضبط/ناشر را تطبیق دهید"
    },
    {
      "artist_id": "AB-CAND-002",
      "display_name_fa": "سامی بیگی",
      "official_or_latin_name": "Sami Beigi",
      "aliases": [],
      "slug": null,
      "entity_type": "UNKNOWN",
      "short_bio": null,
      "full_bio": null,
      "profile_image": null,
      "featured_image": null,
      "genres_as_reported": [
        "پاپ"
      ],
      "official_website": null,
      "verified_social_profiles": [],
      "related_track_ids": [],
      "related_album_ids": [],
      "related_video_ids": [],
      "site_page_status": "UNKNOWN",
      "identity_status": "NEEDS_REVIEW",
      "completion": {
        "name": "NEEDS_REVIEW",
        "slug": "INCOMPLETE",
        "biography": "INCOMPLETE",
        "featured_image": "INCOMPLETE",
        "reliable_sources": "NEEDS_REVIEW",
        "official_links": "UNKNOWN",
        "track_album_relationships": "UNKNOWN",
        "artist_page": "UNKNOWN",
        "seo_title_description": "INCOMPLETE",
        "broken_links_and_duplicates": "NEEDS_REVIEW",
        "final_quality_control": "INCOMPLETE"
      },
      "priority": "P0-Global",
      "segment_as_reported": "معاصر",
      "seed_reason": "در ۱۰ هنرمند نخست نمایهٔ عمومی FarsiChart",
      "seed_source_snapshot": "2026-09-30; Spotify public monthly listeners",
      "rights_status": "UNVERIFIED",
      "source_refs": [],
      "next_action": "فهرست آثار و مسیر اخذ مجوز را بررسی کنید",
      "last_reviewed_on": null,
      "review_notes": "این مورد فقط نامزدِ صف تحقیق موجود در مخزن است؛ ثبت در سایت یا تأیید هویت/منبع/حقوق از آن نتیجه نمی‌شود.",
      "seed_next_action": "فهرست آثار و مسیر اخذ مجوز را بررسی کنید"
    },
    {
      "artist_id": "AB-CAND-003",
      "display_name_fa": "هایده",
      "official_or_latin_name": "Hayedeh",
      "aliases": [],
      "slug": null,
      "entity_type": "UNKNOWN",
      "short_bio": null,
      "full_bio": null,
      "profile_image": null,
      "featured_image": null,
      "genres_as_reported": [
        "پاپ کلاسیک"
      ],
      "official_website": null,
      "verified_social_profiles": [],
      "related_track_ids": [],
      "related_album_ids": [],
      "related_video_ids": [],
      "site_page_status": "UNKNOWN",
      "identity_status": "NEEDS_REVIEW",
      "completion": {
        "name": "NEEDS_REVIEW",
        "slug": "INCOMPLETE",
        "biography": "INCOMPLETE",
        "featured_image": "INCOMPLETE",
        "reliable_sources": "NEEDS_REVIEW",
        "official_links": "UNKNOWN",
        "track_album_relationships": "UNKNOWN",
        "artist_page": "UNKNOWN",
        "seo_title_description": "INCOMPLETE",
        "broken_links_and_duplicates": "NEEDS_REVIEW",
        "final_quality_control": "INCOMPLETE"
      },
      "priority": "P0-Global",
      "segment_as_reported": "میراث",
      "seed_reason": "در ۱۰ هنرمند نخست نمایهٔ عمومی FarsiChart",
      "seed_source_snapshot": "2026-09-30; Spotify public monthly listeners",
      "rights_status": "UNVERIFIED",
      "source_refs": [],
      "next_action": "دارندهٔ حقوق هر ضبط و تصویر جداگانه شناسایی شود",
      "last_reviewed_on": null,
      "review_notes": "این مورد فقط نامزدِ صف تحقیق موجود در مخزن است؛ ثبت در سایت یا تأیید هویت/منبع/حقوق از آن نتیجه نمی‌شود.",
      "seed_next_action": "دارندهٔ حقوق هر ضبط و تصویر جداگانه شناسایی شود"
    },
    {
      "artist_id": "AB-CAND-004",
      "display_name_fa": "معین",
      "official_or_latin_name": "Moein",
      "aliases": [],
      "slug": null,
      "entity_type": "UNKNOWN",
      "short_bio": null,
      "full_bio": null,
      "profile_image": null,
      "featured_image": null,
      "genres_as_reported": [
        "پاپ کلاسیک"
      ],
      "official_website": null,
      "verified_social_profiles": [],
      "related_track_ids": [],
      "related_album_ids": [],
      "related_video_ids": [],
      "site_page_status": "UNKNOWN",
      "identity_status": "NEEDS_REVIEW",
      "completion": {
        "name": "NEEDS_REVIEW",
        "slug": "INCOMPLETE",
        "biography": "INCOMPLETE",
        "featured_image": "INCOMPLETE",
        "reliable_sources": "NEEDS_REVIEW",
        "official_links": "UNKNOWN",
        "track_album_relationships": "UNKNOWN",
        "artist_page": "UNKNOWN",
        "seo_title_description": "INCOMPLETE",
        "broken_links_and_duplicates": "NEEDS_REVIEW",
        "final_quality_control": "INCOMPLETE"
      },
      "priority": "P0-Global",
      "segment_as_reported": "میراث",
      "seed_reason": "در ۱۰ هنرمند نخست نمایهٔ عمومی FarsiChart",
      "seed_source_snapshot": "2026-09-30; Spotify public monthly listeners",
      "rights_status": "UNVERIFIED",
      "source_refs": [],
      "next_action": "فهرست آلبوم‌ها و مالک کاتالوگ بررسی شود",
      "last_reviewed_on": null,
      "review_notes": "این مورد فقط نامزدِ صف تحقیق موجود در مخزن است؛ ثبت در سایت یا تأیید هویت/منبع/حقوق از آن نتیجه نمی‌شود.",
      "seed_next_action": "فهرست آلبوم‌ها و مالک کاتالوگ بررسی شود"
    },
    {
      "artist_id": "AB-CAND-005",
      "display_name_fa": "ابی",
      "official_or_latin_name": "Ebi",
      "aliases": [],
      "slug": null,
      "entity_type": "UNKNOWN",
      "short_bio": null,
      "full_bio": null,
      "profile_image": null,
      "featured_image": null,
      "genres_as_reported": [
        "پاپ کلاسیک"
      ],
      "official_website": null,
      "verified_social_profiles": [],
      "related_track_ids": [],
      "related_album_ids": [],
      "related_video_ids": [],
      "site_page_status": "UNKNOWN",
      "identity_status": "NEEDS_REVIEW",
      "completion": {
        "name": "NEEDS_REVIEW",
        "slug": "INCOMPLETE",
        "biography": "INCOMPLETE",
        "featured_image": "INCOMPLETE",
        "reliable_sources": "NEEDS_REVIEW",
        "official_links": "UNKNOWN",
        "track_album_relationships": "UNKNOWN",
        "artist_page": "UNKNOWN",
        "seo_title_description": "INCOMPLETE",
        "broken_links_and_duplicates": "NEEDS_REVIEW",
        "final_quality_control": "INCOMPLETE"
      },
      "priority": "P0-Global",
      "segment_as_reported": "میراث",
      "seed_reason": "در ۱۰ هنرمند نخست نمایهٔ عمومی FarsiChart",
      "seed_source_snapshot": "2026-09-30; Spotify public monthly listeners",
      "rights_status": "UNVERIFIED",
      "source_refs": [],
      "next_action": "فهرست آلبوم‌ها و مالک کاتالوگ بررسی شود",
      "last_reviewed_on": null,
      "review_notes": "این مورد فقط نامزدِ صف تحقیق موجود در مخزن است؛ ثبت در سایت یا تأیید هویت/منبع/حقوق از آن نتیجه نمی‌شود.",
      "seed_next_action": "فهرست آلبوم‌ها و مالک کاتالوگ بررسی شود"
    },
    {
      "artist_id": "AB-CAND-006",
      "display_name_fa": "آرتا",
      "official_or_latin_name": "Arta",
      "aliases": [],
      "slug": null,
      "entity_type": "UNKNOWN",
      "short_bio": null,
      "full_bio": null,
      "profile_image": null,
      "featured_image": null,
      "genres_as_reported": [
        "رپ"
      ],
      "official_website": null,
      "verified_social_profiles": [],
      "related_track_ids": [],
      "related_album_ids": [],
      "related_video_ids": [],
      "site_page_status": "UNKNOWN",
      "identity_status": "NEEDS_REVIEW",
      "completion": {
        "name": "NEEDS_REVIEW",
        "slug": "INCOMPLETE",
        "biography": "INCOMPLETE",
        "featured_image": "INCOMPLETE",
        "reliable_sources": "NEEDS_REVIEW",
        "official_links": "UNKNOWN",
        "track_album_relationships": "UNKNOWN",
        "artist_page": "UNKNOWN",
        "seo_title_description": "INCOMPLETE",
        "broken_links_and_duplicates": "NEEDS_REVIEW",
        "final_quality_control": "INCOMPLETE"
      },
      "priority": "P0-Global",
      "segment_as_reported": "معاصر",
      "seed_reason": "در ۱۰ هنرمند نخست نمایهٔ عمومی FarsiChart",
      "seed_source_snapshot": "2026-09-30; Spotify public monthly listeners",
      "rights_status": "UNVERIFIED",
      "source_refs": [],
      "next_action": "نسخهٔ صحیح پروفایل/هم‌نام‌ها را تأیید کنید",
      "last_reviewed_on": null,